{
    "id": "subrace_halfling_lightfoot",
    "name": "Lightfoot Halfling",
    "parentRaceId": "race_halfling",
    "lore": {
        "shortDescription": "Lightfoot halflings are nimble and sociable, often blending into their surroundings.",
        "fullText": "As a lightfoot halfling, you can easily hide from notice, even using other people as cover. You're inclined to be affable and get along well with others. In the Forgotten Realms, lightfoot halflings have spread the farthest and thus are the most common variety.\nLightfoots are more prone to wanderlust than other halflings, and often dwell alongside other races or take up a nomadic life. In the world of Greyhawk, these halflings are called hairfeet or tallfellows."
    },
    "traitsAdded": [
        "trait_halfling_lightfoot_ability_bonuses",
        "trait_naturally_stealthy"
    ]
}